[
  {
    "name": "SHOT_01_TAKE_01",
    "prompt": "Rafa Lobo caminhando lentamente em um escritório moderno de luxo, iluminação cinematográfica, lente 35mm, ultra realista, 8k",
    "image_path": "C:\\B2-AI-STUDIO\\productions\\a5ee3190-bae8-479d-ac4b-2cd9d3420332\\start_frame_01.png",
    "model": "Kling 3.0",
    "resolution": "720p",
    "aspect_ratio": "9:16",
    "duration_seconds": 5
  }
]